Topic 1,Year,Quarter,Summary
Acquisition,2016,Q1,the results for our first quarter fiscal 2017 incorporate for the first time the financial performance of the newly acquired brakes group . Sysco corporation's first quarter results included some items related to the brakes acquisition . The acquisition will be accretive to earnings per share by low to mid-single digits in fiscal 2017 .
Acquisition,2017,Q1,"the company announced the acquisition of angie's boomchickapop . we've been active particularly in m&a in the last year . we recently acquired hfm foodservice, a hawaii-based broadline distributor . We exercised our option to basically acquire that business completely recently . a good chunk of that acquired business improvement is in food and snacks . some of the major acquired businesses are seeing some momentum the other way ."
Acquisition,2017,Q2,"the company completed its $250 million acquisition of angie's artisan treats . It also announced an agreement to acquire sandwich bros. during the quarter, we marked our 1-year anniversary . this increase supported our share repurchases and the $250 million acquisition of angie's boomchickapop . We have all seen high multiples in m&a in food in general for the last few years . Sure has a robust pipeline of acquisition opportunities . We have said that we have a broader and bigger ambition for acquisitions . investors could have imagined tyson doing that acquisition a year ago . merger and integration costs will be separate out . ""there was a lot of reinvestment on the hillshire acquisition,"" says dennis leatherby ."
Acquisition,2017,Q3,"we expect to close this acquisition this summer . In the most recent case with thanasi foods, it happened to be a modernizing acquisition . Flowers' margins have continued to improve since the acquisition  . Starbucks corporation has a major opportunity to lean in hard on customer acquisition . In the short term, we see some significant promotional and just old-fashioned block-and-tackle customer acquisition opportunities . advancepierre acquisition gives the company capabilities, so production capabilities . the acquisition of the company makes the company particularly powerful . a number of other acquisitions have been made in the past year, including a u.s. based company ."
Acquisition,2017,Q4,"question and answer operator asks if larger m&a is necessary to hit current margin goals . ""we don't guide at a segment level, but you can gather from my comments that we are expecting significant improvement"" we have almost 1 point of growth coming from the last 4 months of the acquisition of simplyprotein . Sg&a was up year-over-year to 13.4% of revenue due to acquisition activity . acquisition is not a major component of the procurement savings . the acquisition is a small part of the savings in the procurement process ."
Acquisition,2017,Unknown,the underlying ebitda margin decreased to 21.5% from 23.5% last year due to the impact of the spicetec acquisition . gross margin declined from 46.2% in 2015 to 45.6% this year mainly as a result of the lower gross margin on the acquired spicetec flavors business . spicetec acquired conagra to go after other food and beverage classes in the u.s. spicetec signed development partnership with amyris to develop new active .
Acquisition,2018,Q1,"the acquisition of pinnacle foods is expected to close by the end of october . flowers has a team completely focused on value creation, strategic growth and acquisitions . once we fully implement sap, we have a platform for bolt-on acquisition that drives synergy . sap is an open source software development company based in london ."
Acquisition,2018,Q2,"we have the opportunity to build that momentum over time with the acquisition of pinnacle . we do expect to see m&a in the next 3 to 4 years as well . the acquisition of wellness foods simplyprotein brand contributed 1.1% to sales growth . ""just keep a normal view of d&a is reasonable,"" says cunfer . any m&a benefit will be incremental to that, so we feel great about where we're positioned . if there's a benefit, we'll be able to make a profit incrementally ."
Acquisition,2018,Q3,"acquisitions added 500 basis points of growth in the quarter . organic net sales grew 2.6% as the acquisition of sandwich bros. added 60 basis points . During the third quarter, we prepaid another $180 million on our term loan secured as part of the acquisition financing . Starbucks is in a phase of growth in china that is primarily driven by new-store expansion . Tyson foods, inc. has 2 accretive potential acquisitions rolling on its books . the acquisitions are expected to be completed by the end of the year ."
Acquisition,2018,Q4,"Conagra will discuss its agreement to acquire pinnacle foods and fourth quarter results . importantly, we're confident in our ability to successfully integrate this acquisition . Industrial base business achieved 6% constant-currency growth ."
Acquisition,2018,Unknown,"since 2014, we have acquired businesses for a total of 691 million . Acquisitions contributed chf 177million . the main increase in the leverage ratio was the impact of the acquisitions we completed during 2017 . backward integration is a good point, but we're not going to acquire land . the acquisition of naturex fits fully our 2020 strategy . Group sales increased by 5.6% on a like-for-like basis, which excludes any currency impact ."
Acquisition,2019,Q1,"Wyman t. roberts is stepping up its loyalty program with regard to acquisition . we have reduced gross debt by over $1 million since the close of the pinnacle acquisition in the second quarter of fiscal '19 . very little case volume was attributed to any m&a activity . Sysco corporation announced a $155 million acquisition at the end of the quarter . the company is focused on organic growth and value-enhancing m&a opportunities . the acquisitions of keystone, brazil foods, are going to be paid down ."
Acquisition,2019,Q2,"international net sales increased 7.3% primarily due to the acquisition of pinnacle . It also acquires new brands where its playbook can easily be applied . Flowers has an attractive pipeline of potential m&a opportunities . ""we're not -- and the kind of acquisitions that we would look for will be consistent with what we've done and messaged in the past,"" he says . last week, 2 new acquisitions were made public, one in the u.s., and one in ireland . the acquisition of brf's thai and european poultry operations is expected to close in fiscal third quarter . Tyson foods, inc. has done acquisitions with keystone and pending brazil foods ."
Acquisition,2019,Q3,"Canyon bakehouse, acquired in late 2018, contributed 2.2% . A portion of this cash was used to pay down $206 million of acquisition debt . as our business has accelerated, our m&a strategy narrowed . we continue to expand our global business with newly acquired operations in asia and europe ."
Acquisition,2019,Q4,"Brinker expects to close the erj acquisition a bit later in this first quarter . Wyman t. roberts is developing plans for the 116 acquired stores . the company will continue to be dilutive to its year-over-year gross margin until we anniversary the acquisition . We reduced our acquisition debt in the fourth quarter by $209 million . we ended the year with net debt of just over $2.1 billion, down $804 million since the private brands acquisition . Sales dollars grew 6% to a record $42.4 billion driven mostly by chicken-related purchases ."
Acquisition,2019,Unknown,"the beginning of 2018 was marked by our game-changing acquisition of naturex . since 2014, we have acquired 9 businesses for a total of over chf 2.5 billion . naturex has been acquired by Givaudan for a total of over chf 2.5 billion . the acquisition of naturex fits fully with our 2020 strategy ."
Acquisition,2020,Q1,"Focusing on our brands, prioritizing improved margins, pursuing smart m&a and developing the team . A decline in the level of m anda activity is continuing right now ."
Acquisition,2020,Q2,"flowers has a really good track record of m&a . since we went public in 1968, we've completed more than 100 acquisitions . mcmullian: ""m&a has always played a vital part of our growth story"" the french businesses were acquired even prior to our acquisition of brakes ."
Acquisition,2020,Q3,the company fully paid off terms notes related to the acquisition of the frank's french's brands . ebro riviana north american pasta businesses will dovetail with our strengths .
Acquisition,2020,Q4,"birds eye continued to lead frozen single-serve peers in new buyer acquisition . ""paying down debt and attractive m&a targets to drive growth are our 2 best uses of cash,"" says mcmullian . atkins net sales increased 59.7% in the fourth quarter, driven by the quest acquisition . ""it's interesting from a people standpoint, organizationally more like a merger,"" he says ."
Acquisition,2020,Unknown,"since 2014, we have acquired 15 businesses for a total of over chf 3.6 billion . last 15 acquisitions were strictly aligned with 2016-2020 strategy to increase stake . Integration costs amount to around 10% of the acquired sales . Givaudan sa has made 15 acquisitions in the last 4 years . Almost all our acquired companies are driving very good growth . the group incurred costs of chf 24 million related to acquisition and restructuring costs . we'll hear more about end of august on m&a strategy ."
Acquisition,2021,Q1,"the addition of our cholula and fona acquisitions extended the reach and breadth of our portfolio . In the americas, flavor solutions constant currency sales grew 2% . sales teams are doing an extraordinarily good job acquiring new customers . we're still proactively looking at acquisitions more on the growth side ."
Acquisition,2021,Q2,"at the end of the second quarter, we achieved our net leverage ratio target of 3.6x, down from 5x at the closing of the pinnacle acquisition . organic sales, stripping out acquisitions, are up 22% . ""we would highlight that very encouraged by our debt buy- down from the debt we took on for the quest acquisition"""
Acquisition,2021,Q3,"we are also poised for acquisition activity should the right opportunity come along . Consumer segment sales grew 1%, including favorable impact from currency and incremental sales from cholula acquisition . ""the buy rate has been a buffer against that,"" says scalzo . ""we've had a lot of success acquiring new buyers on atkins,"" he says ."
Acquisition,2021,Q4,"we're focused very heavily in the midwest, which was the acquisition we did 2 years ago . ""we didn't just acquire new consumers. He thinks we can still be active with acquisitions while we implement other pieces of strategy . Mccormick & company, inc. expects to grow in 2021, independent of acquisitions . Sysco will close on the greco and sons acquisition in the coming weeks ."
Acquisition,2021,Unknown,"the company has made 16 acquisitions for a total of over chf 3.6 billion since 2014 . in terms of m&a, we are really, really happy about the fact that we did not comment ."
Acquisition,2022,Q1,Sysco has closed on 2 independent italian distributor acquisitions over the past quarter . 'we've obviously not provided percent lift in penetration lists and customer acquisition targets'
Acquisition,2022,Q2,greco acquisition has changed that strategy in a meaningful way . m&a is our fourth priority and we're looking forward to it .
Acquisition,2022,Q3,"we continue to monitor the deal market, actively seeking potential acquisitions . the company closed on the coastal companies acquisition in the last quarter . it was the highest we've had since the acquisition of quest ."
Acquisition,2022,Q4,"we've been saying for some time now, our appetite rather for m&a is certainly high . Consumer segment sales grew 10%, including incremental sales from our cholula acquisition ."
Acquisition,2022,Unknown,"since 2014, we have acquired 20 businesses for a total of over chf 4.1 billion . we will continue our focus on integrating the recently acquired businesses in our givaudan operating platform . the group incurred chf 4 million related to acquisition and restructuring costs . the integration of acquired companies continues to make good progress ."
Acquisition,2023,Q1,"we were expecting based on the level of the buy, the quality of the purchase . ""right now, our focus is on continuing to pay down debt,"" he says . don can be stronger in acquiring net new customers . interest expense driven by higher debt associated with planned acquisition of don . silberman ."
Acquisition,2023,Q2,marketing can be as much about retention as it is acquisition . Canyon's fourth priority is smart m&a . Papa pita acquisition added 1.6% .
Acquisition,2023,Q3,"he will be working closely with me on finding new revenue streams . his fourth priority is smart m&a, expanding our geographic coverage ."
Acquisition,2023,Q4,"we expect the acquisition to drive further manufacturing and distribution synergies . we evaluate debt paydown, share buyback and m&a opportunities ."
Acquisition,2023,Unknown,"this result includes the full year impact of ddw and custom essence, the 2 companies that we acquired in december 2021 . on acquisitions, we are actively looking in an opportunistic way ."
Acquisition,2024,Q1,"when quest was acquired, the business was, by far, majority of bar business . tanner ceo geoff e."
Acquisition,2024,Q2,ready chef acquired ready chef in ireland for $1.3 billion . a small acquisition with ready chef signaled a shift in strategy .
Acquisition,2024,Q4,"the papa pita acquisition added 1.1% . the northlake coffee acquisition has had an enormous impact on the coffee business . he's more optimistic about m&a activity, seeing more founders ."
Acquisition,2024,Unknown,"the m&a pipeline has been quiet, but we're active in '23 . can we assume that the pipeline is now again higher on the agenda given free cash flow?"
Better-for-You,2017,Q1,we're also launching the highly anticipated gluten-free breakfast sandwich soon . the biggest effect has been in the better-for-you premium private label area .
Better-for-You,2017,Q2,"there are no artificial flavors, no added msg, they're gluten-free and are in bpa-free packaging ."
Better-for-You,2017,Q3,the big growth in private label right now is coming from the better-for-you sectors . we're the private-label leader in 20 of these 32 categories .
Better-for-You,2017,Q4,7 of our 10 meal bars have been converted to clean labels and rolled out . Approximately 20% of our legacy products are now in premium and better-for-you categories .
Better-for-You,2018,Q1,"the company has premium, better-for-you, natural and organic offerings . the company is headquartered in san francisco, california ."
Better-for-You,2018,Q2,7 of our 10 meal bars and 4 out of our 11 snack bars have been converted to clean labels . a total of 11 clean labels have been added to our bars .
Better-for-You,2018,Q3,Canyon bakehouse is a top gluten-free loaf brand in the u.s. many consumers that are gluten intolerant have exited the category .
Better-for-You,2018,Q4,"""it's hard to think the law of large numbers is setting in for the better-for-you"" segment now considered a growth asset ."
Better-for-You,2019,Q1,"Mccormick has relaunched its new clean and natural platform, flavorreal . the company is based in san francisco ."
Better-for-You,2019,Q2,"as we close out the year, the clean label initiative will mostly be done . the 'clean label' initiative is expected to be completed by the end of the year ."
Better-for-You,2019,Q4,"endulge products fit the keto profile, which is a high-fat profile for keto enthusiasts . the product line is available in a variety of sizes and shapes ."
Better-for-You,2020,Q1,"reemergence of bellring's premier, slimfast's advanced line and keto line . re-emergence of slimfast ."
Better-for-You,2020,Q2,"Canyon bakehouse has become the #1 gluten-free brand in the short 2-year period that we've owned them . despite calls for the gluten free category's demise, it continues to grow ."
Better-for-You,2020,Q3,"two new plant-based protein offerings to market, a spicy nugget and a whole grain tender . a total of 3 new protein offerings were introduced to market ."
Better-for-You,2020,Q4,"it's all on us to increase consumer awareness about gluten-free on the bread shelf . 'we're going to have to do more to raise awareness,' says a spokesman ."
Better-for-You,2021,Q2,Canyon's private label gluten-free is the one private label that continues to do well . the company continues to grow in popularity .
Better-for-You,2021,Q4,canyon's doubled its share of the gluten-free bread category to 34 share . the company now has around a 34 share in the category .
Better-for-You,2022,Q1,Sysco is proud to be a partner organization at the recent white house conference on hunger . we built leading shares in the low organic and gluten-free categories .
Better-for-You,2022,Q2,"base culture is a gluten-free and grain-free baked foods company . It's all keto and paleo-certified, very much on trend ."
Better-for-You,2022,Q3,"broad snacking, better-for-you and more indulgent snacking are less impacted than center store food categories . ."
Better-for-You,2023,Q1,we've gone from grain-free to cauliflower to keto in the last few years . cauliflower has become a staple of our diet .
Better-for-You,2023,Q2,Canyon bakehouse lost 230 basis points of gluten-free unit share in second quarter . the company's unit share fell to a minus-minus of 5% .
Better-for-You,2023,Q3,"a shortage of gluten-free capacity impacted our ability to meet consumer demand . ""indiscernible"" is a good thing, not unlike keto was for us, he adds ."
Better-for-You,2023,Unknown,"Primelock, a natural vegan-friendly solution that mimics animal fat cells, encapsulates, protects and locks in both flavor and fat in plant-based meat substitutes ."
Better-for-You,2024,Q4,Canyon bakehouse is optimistic about the growth potential of its gluten-free bread brand . the brand has been a success for more than a decade .
Commodities,2017,Q1,value-added business in chicken is up 5% and commodities were down . Reiterating expectation of mid-single-digit increase in raw materials for 2017 .
Commodities,2017,Q2,"we're seeing some real favorability in some commodity products, primarily in the beef world . expect commodities and foreign exchange to be negatively impacted in the back half of the year ."
Commodities,2017,Q3,"higher commodity costs and higher freight cost are some headwinds . in 2018, we'll be well-positioned to take advantage of innovation, brand strength, channel breadth and low-cost raw materials ."
Commodities,2017,Q4,commodity headwinds across a few categories . riordan: 'we are facing some commodity headswinds' .
Commodities,2017,Unknown,"overall, raw materials for the year were somewhere between 0 and 1% . If you look at raw materials in 2016, they increased by 7.7% . There's a 2% to 3% increase in raw material costs for 2016 ."
Commodities,2018,Q1,"we are experiencing inflation in packaging, transportation and other commodities . ""commodities, you said, are somewhat similar front half, back half,"" says kinsey ."
Commodities,2018,Q2,"flowers was impacted by inflationary pressures from higher transportation cost, a tight labor market and increasingly volatile commodity markets . we are very pleased that it's going to flip from just covering commodities to effectively covering commodities and freight ."
Commodities,2018,Q3,"A couple quarters in a row into 2%, 3% commodity inflation . The private-label industry is impacted by freight, as much or more by commodities ."
Commodities,2018,Q4,"in the fall, we believe it was $30 million of commodity costs, and that's gone to $40 million . only 7 commodities are lower than 2017, and there's 33 that are effectively up ."
Commodities,2018,Unknown,"in 2018, we expect raw materials to increase overall from 5% to 6% . if we want to protect 10,000 raw materials, we would need to make a significant amount of backward integrate ."
Commodities,2019,Q1,"the commodity cycle is not as aggressive as it was a year ago . ""from a chili's perspective, you have low single- digit commodity inflation,"" says wyman t. roberts ceo ."
Commodities,2019,Q2,"private label store brands take up more commodity piece of the market . ""we believe we've got the best quality,"" says ryals mcmullian ."
Commodities,2019,Q3,"a move to raw material has had a bigger impact on flavor and seasoning business . ""we are expecting inflation on the raw material costs,"" says noel white ."
Commodities,2019,Q4,"but coming off a very low commodity cycle, it's prudent for us to expect low-level inflation . Refranchising would help insulate against sales volatility, labor and commodity inflation , in 2019 we're looking more at low single-digit inflation from a commodity perspective ."
Commodities,2019,Unknown,"no impact of raw materials, apart from the mechanical dilution . the full impact on the ebitda of fragrances has to do with raw materials increase ."
Commodities,2020,Q1,"we source over 14,000 raw materials from over 85 countries in the world . prepared foods profit margin in the first quarter was impacted by an $80 million increase in raw material costs ."
Commodities,2020,Q2,"we source over 14,000 raw materials and packaging items globally . ""it's not much to say on our commodities at this point,"" says steve o'connor ."
Commodities,2020,Q3,"""we don't think of an inflationary commodity environment, not at this point,"" he says . idled plants and reduced capacity in our pork facilities had impacts on raw materials ."
Commodities,2020,Q4,"wells fargo says it's the seventh consecutive quarter of a positive commodity metric . the plants need to cover their own labor inflation, not commodity inflation ."
Commodities,2020,Unknown,around 37% to 40% of our sales is raw materials . this is very closely matched to the currencies in which we sell . .
Commodities,2021,Q1,"Commodity inflation is definitely picking up . a lot of commodities and packaging, to your point, is already contracted . commodities are already on the rise ."
Commodities,2021,Q2,"we're seeing some increases in the last month or 2 in some agricultural commodities . however, commodity, freight and packaging inflation has continued to escalate ."
Commodities,2021,Q3,"the commodity market looks fairly good . Commodities, logistics and freight, and labor are three buckets on which we are focused ."
Commodities,2021,Q4,70 % of our costs are really raw material and packaging . commodity costs at current levels hold and we are able to offset inflation .
Commodities,2021,Unknown,we expect a raw material environment of around 1% in the year . we expect an average of 1% of raw material to be used in the uk .
Commodities,2022,Q1,"Mccoromick & company has more raw materials now than it did last year . we are not fully covered for the year, but there are some commodities that we are fully covered on ."
Commodities,2022,Q2,food and beverage costs were unfavorable 120 basis points driven by commodity inflation . but we do still believe commodities are cyclical .
Commodities,2022,Q3,the company's biggest challenge is commodity inflation . we didn't see a big increase and start to see the increase in commodities .
Commodities,2022,Q4,Approximately 70% of our key raw materials are covered for 2022 . this year is the mid-teens really driven by large commodity packaging and freight increases .
Commodities,2022,Unknown,"we don't have so much appetite, if i may say so, for commodities . is this all just offsetting raw material inflation?"
Commodities,2023,Q1,Approximately 80% of our key raw materials are covered in 2023 . the good news is we do not over-index on any commodities from a volume standpoint .
Commodities,2023,Q2,"Approximately 93% of our key raw materials are covered in 2023 . Easing inflationary cost environment, softening of spot markets in most commodities ."
Commodities,2023,Q3,"Commodity inflation expected to be down in the lower single-digit range . At quarter end, approximately 96% of our key raw materials for 2023 were covered ."
Commodities,2023,Q4,"we're focused on the premiumization of the vegetable category, not commodity vegetables . Approximately 60% of our key raw materials are covered by 2023 ."
Commodities,2023,Unknown,"we've seen some raw materials deflating year-to-date . we are not in the commodity market,"" he said ."
Commodities,2024,Q1,"lower raw material cost and operational efficiencies offset by higher brand support expenses . Tyson foods, inc. has a very diverse commodity risk management group ."
Commodities,2024,Q2,we're expecting kind of more normalization of the commodity markets as we move forward . but it will all depend on the evolution of those commodity markets .
Commodities,2024,Q3,"within frozen vegetables, there's commodity vegetable tier, premium steamer and value-added tier . the company is doing more value over volume ."
Commodities,2024,Q4,Approximately 70% of our key raw materials are covered in 2024 . he says we continue to see relatively elevated commodity as overall .
Distribution,2017,Q1,"Conagra's consumption, on average, tracks pretty close to our shipments . The change in shelf space and items in distribution at one retailer occurred during the fourth quarter of last year ."
Distribution,2017,Q2,"Flowers successfully contracted with third parties to expand distribution in the midwest . Dave's killer bread sales continued to grow, benefiting from the full support of our dsd network ."
Distribution,2017,Q3,"""conagra is still losing overall distribution points"" Shipments are up 5% year-over-year behind 2 of our 3 $1 billion brands ."
