Keyword,Adjusted_Score
restaurant-level operators managed wage cost level,4
France tourism social unrest,4
FICA indiscernible ] credit activity,4
advantages control store-level service,4
constraints eye continued lead frozen single-serve,5
EPS synergy over-delivery,3
millennials moisture simple way,3
CFO baton Rachel Ruggeri,4
core John good move,3
bulk lean deployment,3
relevant staples portfolio despite supply,3
EBITDA include adjusted,3
first-time users guest checkout feature feature for first-time,7
off-cycle resolution season,3
incredible progress progress on managerial turnover,3
mobile app non-reward customers,4
presence evidence growth opportunities at scale,3
u.s top gluten-free loaf brand,3
a. Director Yes,3
tiers traditional retailers,3
export IFG business called,3
dramatic headwinds aggressive pricing strategies,3
new package separate things old package shows,5
bars represent households with income,3
endulge iced coffee shakes,4
poultry slow start,3
a. Director Tastykake Tastykake had,4
[ Operator Instructions,3
took incremental low-end customer tail-off,4
honor interim role pivotal time time for TreeHouse,4
Gardein alternative space,3
Naturex natural colors,3
cocoa multiple snack categories share gains in multiple,4
CHF reached sales like-for-like basis,3
ads tested new buyers,3
atkins grow household penetration,3
beef exports remained,3
global demand higher-grading beef products,4
total check Mobile Order,3
customers campaign Restaurants Rising,3
goldman skeptics sea,3
Divestitures FX impacted net,3
normal seasonality seasonality for Pork,4
subsegments nutritional snacking category,3
inflationary headwinds china impacted,3
machine fuel deep brew,3
inflationary pressures strain consumer confidence,3
consensus on-algorithm type,3
fundamentals recruitment new commercials,3
generate plenty ample ample free cash flow,4
core stay focused,3
leverage powerful balance sheet,3
P vary quarter-to-quarter,3
hog ongoing recovery,3
plants different extents noel white CEO,5
strategic move front row seat seat on next-generation,5
access fine fragrance beauty,3
barclays mid-single-digit traffic,3
program functional excellence,3
cnn waterfall foulston provided chart on page,5
in-dining room operations,3
shelf leading indicator,3
suburban drive-through central business districts,4
barclays deep brew machines,3
chive bakes new menu items,3
conservative view view on core,4
millennials contemporary frozen,3
retention sign-on bonuses bucket of snapback,5
maggiano delivery individual level,3
chili Oldtimer with cheese new ad campaign,5
QSRs limited time offers,3
good [ Audio Gap,3
maggiano strong holiday delivery,3
barrier prior compensation program,3
federal minimum wage minimum wage increase,5
Europe South Asia,3
LIBOR previous spread loan on march,3
cold-brew coffee single cup coffee,5
herds key global beef,3
Fragrance compounding room room in china,4
unshakable trend trend toward convenience,4
digital marketing infrastructure with regard,3
personalization real-time triggers new offer constructs,5
overall buy rate on-the-go usage occasions,4
maggiano vehicles full in-house delivery in-house delivery system,7
dual responsibility manage price stability,3
online off-premise orders % of off-premise,4
pro forma forma net,3
engagement recommendations intensity saw significant lifts,4
farha Stephens Inc.,3
q Fresh Meats,3
manager leverage industry- leading levels,4
customers specific ingredients ask for pricing,3
EPS flowers raised the bottom,4
Americas CPG high-single digits,3
outstanding partners strong customer connection,3
population direct negative impact supply chain productivity,3
chili issues affected product,3
Chili guests inflationary environment,3
efficient manufacturing low material losses,3
qualified frontline employees,3
cnn Steve Oakland,3
first quarter remains signal for first quarter,3
TDP proactive discontinuations,3
B Irish Oatmeal small step,4
whipped toppings alternatives grew frozen plant-based meat,6
COVID crisis had resilient part,3
upscale premium contract pack business,3
young consumers u.s. population,3
hurricane ida domestic rates,3
freeman director retire in march,3
atkins frequent snacking occasions,3
chili folks ubiquitous brand,3
bimbo outstanding quarter identical distribution model,4
wings potential physical presence,4
FY record-low full-time retail full-time retail partner turnover,7
ability win national contract business,3
birds Duncan Hines suffered sales,4
atkins sustainable program,3
community company established local communities,3
geographies slow recovery,3
order customers Net Promoter,3
sponsor-led stuff leverage loan market,4
chicken historical annual run rate,3
addition acquisitions extended the reach,4
maggiano modifications nature,3
Americas savory flavor products,3
Omicron North America supply chain system,4
operations winter storm yuri,4
gas roll through commodity,3
U.S. drug traditional food,3
donnie Adam D. King,4
allow service busy friday night,4
price rallied outside meat purchases,4
alternatives substantial beachhead,3
shape P competitive advantage,3
club Sam BJ,3
slim Swiss Miss,3
chicken demand-backwards slaughter production organization,4
modest inflation U.S. Broadline,3
company completed Artisan Treats,3
ability pork global markets,3
gluten-free breakfast sandwich,3
associates trained sales peak profitability year,3
voluntary retirement program,3
arrangements european union new beef quota,5
non-independent director thanks,3
geoff E. Tanner When Quest majority of bar,7
flavor impressive meat,3
fundamentals achieve disciplined profitable growth,3
Barclays Bank first question today,3
plant Dakota City past weekend entire testing protocol,6
peers did last night,3
parameters gradual recovery,3
chili tight kitchen environment,3
restaurant-level drive-throughs traditional stores,3
chili digital space,3
EPS calculate adjusted,3
trio TreeHousehold related programs good working,4
split between delivery,3
customers customize own beverage,3
u.s. U.S. Foodservice excellent progress,3
geoff atkins E. Tanner,4
GWAP runners efficient servers,4
cage chicken margarita-grill Chili,4
slimfast segment in nutritious snacking,3
obligation big transformation fundamental things,3
Canyon gluten-free bread category,3
India Puerto Rico,3
GP recent quarter reportable segments,3
discount stay focused,3
accelerate coffee culture,3
delivery value-oriented customer,3
canyon gluten-free bread brand,3
micro-chains traditional borders,3
Dallas Wyman Roberts,3
surprise bank of america,3
solutions enormous step,3
organic growth remarkable comeback,3
noel Dean Banks,3
pleasure Miss Rachel,3
daypart usage ticket usage ticket growth,3
foundations extraordinary change retail grocery industry,4
by-products pork get exported,4
tempest teapot Georgia Dock,4
accomplishment CEO employees,3
first international roastery,3
pound outperform large food peers,3
macros bad experience,3
Nicolaus retail shelf,3
Asia promotional activities,3
pandemic impacted comparable store sales,3
Goodbye Mika Ware,3
childcare on-site clinics,3
CP buying packaged,3
agreement Sandwich Bros.,3
active beauty fantastic success story,3
goldman high single digit % type volume decline,3
big hole fill with regard manager bonuses next year,5
complexity ability fulfill,3
capture operations soft costs,3
company announced mobile order,3
private label entry 30-gram active nutrition protein,3
approach disappointing results remain committed,3
Flavor Solutions nice Consumer-like margins,4
M approach long-term success,3
big wild wild card card for next year,4
barclays grow gross profit profit dollars despite inflation,3
key customer customer had internal store replenishment,4
unprecedented challenges strong organization,3
john month that i retail store partners,3
headwinds EPS remain committed,3
R. prepared remarks Donnie King,5
ability retail sales headwinds constrained,4
bars on-the-go usage occasions,4
Thai European poultry operations,4
nominations cnn heroes,3
goldman st. louis,3
Asia Pacific quarter reflected,3
trips large mass merchants,3
reorganization functional staff management,3
prolong strategic inventory buildup,3
elections present uncertainty,3
October quarterly historical information,3
CHF noncash gain net one-off noncash,4
reorganization voluntary headcount reduction,3
crisis customers stayed focused,4
Director ready-to-drink shake business,3
cdo great to-go experience,3
on-site health clinics,3
alyssa Milano new approach convert core program,6
pinnacle EPS [ near end end ] business weakness,5
periscope environmental conditions,3
freight distribution cost pressure,3
post audio replay call after today,3
private label plays retail landscape today,3
had nice nice gains warehouse snack cake business,5
Deutsche Bank good strategic sense,3
Ryals embarked robust digital transformation,4
b.kolor interesting step part of beauty,4
ideal candidate proven leader high-performance track record,4
peer pre-pandemic baseline,3
history EPS quarter second-highest adjusted EPS,5
Asia Pacific see elevated,4
operator Americas John Ivankoe,4
u.s. offers aimed occasional customers,5
disputes exports continued robust in light,3
bread vibrant categories entire grocery store,3
granular analytics understand consumer attitudes,3
participants perceive sole step growth,4
e-commerce digital content,3
dynamics u.s. herbs,3
P decrease in A,3
North American ready-to-drink business,3
maggiano program liquors,3
total funded lease-adjusted leverage funded debt leverage,5
North America outstanding growth,3
operators warehouse footprints,3
large pickle contract contract in foodservice,3
chatter protein red winter,4
status Italian specialty platform,3
implicit EBIT Pinnacle Foods,3
dividend payout ratio % through fiscal year,3
sustain traffic over-time,3
force retailers national retail,3
underperformance Chicken Beef led,4
Ungerer Indena Cosmetics,3
cut delivery frequency,3
on-the-go usage occasions,3
whole issue issue around incrementality,4
plastics edible oils,3
legacy conagra frozen single-serve,4
governments on-prem dining,3
Director response co-manufacturers,3
DNA trace individual animal animal of origin,6
millennial consumers shop for immediate convenience,4
strong recovery many distinctive distinctive competitive advantage,4
tariffs aluminum steel,3
Texas customers freeze had,3
mika michael hochman,3
disruption weekday morning routines,3
SYGMA lowest-margin segment regional customer,3
EBITDA basis single digits look at something,4
frozen vegetables commodity vegetable tier,4
e-com brick mortar,3
majority cuisine-based selling new customer prospecting,5
scanner Birds Eye,3
beef america asia move from south,5
advantage world of natural sugar,3
Flavor Solutions Solutions did,4
nutrition center-store packaged,3
restaurant-by-restaurant real interesting learning,3
field value-added ingredients,3
FY retroactive benefit back,3
outperforms nutritional snacking category,3
first national advertising campaign,3
fresh package breads category,3
floor Mika Ware,3
kingdom recent reopening,3
chicken case-ready plants,3
delaney 47-year history public company,3
afternoon occasional customers,3
barclays customers accept price increments,4
conditions rapid disinflation,3
rest variable whereas,3
laxman Siren System,3
chili quarter-over-quarter margin moved,3
customers dial in-store operations,4
customers technological integration skills,3
coffee contracts clause,3
ex-snack sales dramatic improvement ex-snack,3
app Chili great job building,3
customers alternative sources,3
historical norms strong pricing power,3
cites improved cleaner holiday merchandising,5
successful dessert bar,3
Audio Gap margin management culture,3
POS abates shape,3
conscious decision invest in above-the-line marketing,4
dual running costs impacted gross margin,3
customers vast majority alternative payment methods,6
press non-GAAP measures direct comparable GAAP,5
home pride white bread,4
atkins low-carb lifestyle weight management,3
MGE program guys quantified,4
response on grocery nice little volume response,4
doordash agreement third-party aggregators,4
complex part actual supply chain supply chain optimization piece,3
regionalization U.S. Broadline,3
distribution Birds Eye Eye declined,4
headwinds incremental promotional activity,3
trends demographic tailwind,3
Meal Prep organic net sales,3
canyon bakehouse lost gluten-free unit share,4
participants listen mode,3
greater-than-expected inflationary year in light,3
laxman rebound in closer,3
keystone European operations,3
chili new feature card,3
customer experienced steady improvement,3
favorable price/mix price/mix in refrigerator,4
EPS guiding adjusted,3
director flexes versus grow strategy,3
machine artificial intelligence help drive traffic,4
COVID-related pay new partner training,3
ups look into next year,3
private-label manufacturing manufacturing for herbs,4
shift from mainstream robusta coffee,3
congress because Beef,3
necessary step trail mix plant,4
unusual pricing behavior beef processing fire,4
cnn Sharma hear from amit,4
customer Core outstanding value,3
food-away-from-home prices food-at- home prices,3
new premium margaritas trade into full-price,3
slight increase incentive compensation payments,3
introduces new menu highlights,3
group exercised multibank committee credit facility,3
multibillion-dollar business U.S. Broadline,3
household celebration good bun season,4
sauce had dry recipe mixes,3
business subtracted wesson oil business,3
peanut butter cup,3
distribute high-quality custom,3
weekly sales faster-than-expected rebound,3
persistent with recent escalation,3
decades COVID-19 resurgences continued industry-wide labor shortage,4
vegetable processing plant,3
international demand demand for beef,4
geoff E. Tanner,3
Banquet single-serve frozen meal brand,4
flexibility multiple sources,3
M geographic coverage,3
associates truck get put,3
health care account expert in nutritional guidance,5
divergence between mass,3
Crédit Suisse had high-teens,3
soup infant feeding business,3
geographies different customer types,3
holiday downturn in traffic,3
Inc. great low-cost low-cost fixed debt,4
hiccups favorable cost trends,3
Pork had herd health issues,4
PSL nice sharp turn,4
atkins rich pedigree,3
retail inventories ship below consumption,4
Omicron variant amplified,3
vaccines pandemic calms,3
guests Chili casual dining,4
cautious view view with regard,4
salespeople order- taking,3
outsized increase INC. reimage program,4
lemon bar peanut butter cup,5
harvest new males increase by mid mid fiscal '22,4
continued at- home eating,3
tailwind armour pulled,3
Killer Bread lower-income consumers,3
barclays fulfill extra demand,4
nitrogen cold brew,3
recent focus traditional loaf breads portfolio beyond traditional loaf,7
material needle- mover,3
tale sense same dynamics,3
flowers implemented a price,3
chicken corn mark-to-market,3
post other online delivery,3
cost-plus board in chicken,3
anticipate from African swine fever,4
Richardson definitive agreement wesson oil brand,5
frequency potential good upside,3
Netherlands subsidiaries u.s.,3
mass merchant food traffic,3
dedication navigate inflationary period,3
widespread vaccine release pent-up dining,5
families near-site health clinics,4
crisis narrow set,3
force physical locations,3
negotiation assume executive oversight,3
cakes brand moved idea for mug,3
plant-based meat alternative,3
M evaluate debt paydown,3
pharmaceutical solutions weight wellness industry,3
atkins trusted leader low sugar solution leader in low carb,5
global population income need for protein,3
good all-in traffic all-in traffic expectation,4
robot Rita runner,3
Asia Pacific COVID-19 impacting performance,3
quick selling bulletins,3
pinnacle EPS acquisition reduced,3
total funded funded debt leverage,3
decent mid-single-digit lift,3
beverage upon delivery,3
Greg global operations,3
poultry beef quicker than pork,5
view inflationary pressure,3
circumstances input successful pricing,3
markets lived expectation by further improving,3
government agencies service global regions,5
chili responsiveness guests good stability,4
customers transparency communication,3
GMs blue bar,3
reason delever ability consistent manner,4
drive-throughs social distancing,3
unfavorable sales Mexican peso,3
chili members today than pre-COVID,4
atkins successful snack brands,3
CHF Active Beauty alternative protein business,4
dynamics season played,3
Pork segment softened business showed showed signs,5
RB aristocrat EPS,3
reality hands full year challenge,3
seasonal surge retail shipments,4
fuel unforeseen worldwide events,3
weed unprofitable accounts,3
off-premise Chili stable quarter-to-quarter,4
trends overall macroeconomic united states,3
atkins cookie chip,3
nature own keto bread,3
majority Beverages operational challenges,3
flavorings customers natural flavors,4
beverages single-serve coffee,3
strong returns organic bread production,3
germany phases company-owned model,3
TMOS lean manufacturing principles,3
government-imposed COVID-19 limited time offers,3
occasional market occasional item item that someone,3
tail end representative view,3
testament commitment fastest-growing major economy,4
amount of independence independence in entrepreneurial thinking,3
'if inflationary pressure increases,3
Chili locations company-owned fleet,4
catch-up game game on pricing,3
addition initiative around lean manufacturing,4
reloads fronts digital flywheel,4
beverage led sixth consecutive quarter,3
takeaway quick service restaurants focus on core,4
Manhattan third-party kitchen location,4
incur pretax charge,3
Europe Asia Pacific,3
plants reliability common threads,4
M activity sellers,3
average order order per customer,3
bedrock fresh bakery brands,3
removal ceilings force members,4
record-shattering mobile order,3
automation huge part see sustained,3
ingredient traditional loaf items,3
Latin America like-for-like sales,3
trends favorable heading,3
Nature Canyon Bakehouse held market share,4
impact on outdoor patio dining,3
units ranked near-end peer group,3
retailers multiple assortment,3
constraints gave color,3
Associates blackbox Vaccaro Raymond,4
Asia Pacific china-based business,3
small player anyone get kind kind of super,4
productivity critical levers,3
reality leverage instrument,3
emergency allotments SNAP,3
beverage tests rigorous set,4
spices hot sauce,3
ladder new customer wins,3
inflationary pressures lower-than-expected sales,3
retail demand historic pre-COVID-19 demand,4
commitment gravitation toward digital interaction,3
INC. Mika Ware,3
constraints unmet demand,3
citrus non-GMO sugar source,4
limited-time holiday beverages,3
retention lift in customer,3
core grown Pound,3
Trenton Canadian Del,3
Deutsche Bank low carbers,3
Darren director p firm,4
penny profit associated Killer Bread,4
Flavor ] elevated,3
variations organic growth selective pruning,4
promotion highlighted healthy produce options,3
pork turkey present year-over-year cost,3
Beef prolonged industry dynamics,3
Panama Costa Rica,3
meat recall did,3
plant-based protein box,3
Southeast Asia single market part,3
millennials buying refrigerated,3
audio invest time understand market progress,3
cannibalization indiscernible ] replacements,4
audio accrual set,3
EBITDA quarter-over-quarter amount embedded,3
engagement customers outpaced,3
e-commerce home digital efforts access through delivery,6
EMEA growth remained entire customer base,3
dayparts late week lunch,3
Iowa Premium beef processing facility,3
election Board Anne Bramman,4
high teens structural margin floor,3
menu chili started,3
hospitality great experience experience for dine-in guest,5
ghost kitchens order,3
war east united states,3
ability favor branded,3
other levers look at productivity,3
non-independent director yes,3
exclusive pre-opening tour,3
everyday urban spice portfolio,3
rattle drop favorability,3
renovation U.S. core everyday herb,5
decision-making process cross-functional strategic customer,3
June St. Paul,3
seasonality February critical period,3
atkins confluence of consumer consumer megatrends around health,5
atkin C-store strong start,3
chili critical investments top line challenges,3
respect organic sales color around cadence,4
clinics preventive screenings chronic condition coaching,6
customers single-serve beverage,3
naturex different spaces natural ingredients,4
deleverage debt-to- EBITDA,3
laxman out-of-home coffee,3
member saw mid-single-digit mid-single-digit kind,3
customers preferred rate 20-year time horizon,3
prepared beef looks,3
mix hit mobile order sales mix,3
favorability contributed interest expense favorability,3
coffee wheats oats,3
slight decrease decrease in trade,3
main FX-neutral EBIT,3
targeted-pricing programs margin lost,3
Fresh Chicken tray pack chicken,5
locations white space,3
spices secondary locations,3
in-store deli saver white meat rotisserie meat rotisserie chicken product,9
% aligned customer-first culture,3
weak trends store-branded retail continued,3
chicken air fried momentum with strong repeat purchase,4
noncash inventory purchase inventory purchase accounting step-up,6
attributes open prairie,3
board approved payout as part,3
beef features planned,3
Frank secret ingredient,3
inopportune tropical cyclone,3
specialty produce expert,3
perks whiteflservice invitation-only program,4
other hand Fragrance Ingredients,3
pressure hearts casual dining,4
amped-up protein bars,3
plant-based alternatives alternative today,3
broadline distribution share of total chicken,3
Ensure Boost high protein,3
Scott maw retire in october,4
customer Seasoning Blends,3
tipped minimum wage,3
fees results benefited incentive compensation expense,3
recovery Asia Pacific,3
pace big catastrophic bump,3
series demand-based innovation portfolio in order,3
meal prep completed new issuance,4
barclays chicken aggressive steps,4
loyalty programs contributed,3
gap Knapp chili,3
operations ended the year,3
crédit Suisse limit adjusted,3
Cold Brew strong beverage performance,3
beverage iced espresso,3
success bad habits,3
CCI prune lower-margin business,3
high correlation correlation in shopping,3
export home co-man grew,3
optimal revenue developed growth maps,3
majority center around performance,3
substantial reduction global hog herd,4
wings disposable vehicle,3
ERP replacement program,3
battle insurers cnn,3
atkins healthy snacking,3
Sous Vide new egg bite,4
clear leader leader in loaf bread,3
african swine fever,3
realignment major customer Flavor Solution,4
host meetings local store tours,3
chili dine-in off-premise sales,3
proprietary cold brew,3
announce greenhouse gas reduction,3
program green aprons,3
sporadic virus resurgences impair consumer mobility,5
margins did quarter- over-quarter,3
CFO Tom Hallam first time i,5
customers limited-time offers,3
MSG artificial flavors,3
subsegment chips view than subsegment brand consumer benefit view,6
aggressive distribution fees,3
Madness campaign aired prime time,4
customer connectivity u.s. North America,5
features new website modern look,4
organization with old-fashioned resolve,3
grain crest in early q4,3
room significant demand destruction,3
negligible customer attrition,3
poultry favorability good guy,3
leverage ratio finished,3
December demand moved,3
chicken distressed inventory,3
cnn smarter than everybody,4
Sandwich Bros. vegetable business,3
egg avian flu issue,4
laxman Rachel Ruggeri,3
presentation Kasey A.,3
disruption external headwinds,3
internal costs continued productivity gains gains meant an increase,4
sisco U.S. science-based climate goal,4
u.s. stay-at-home requirements,3
u.s. multiple vaccines normal consumer shopping,5
freight pressure for everybody,3
pressures subsegments active nutrition,3
u.s. inventory reserves,3
ability members detailed labor models,3
U.K. Eastern European,3
average server server at chili,3
almond drought category endured dramatic cost increases,4
appetizer unlimited drinks,3
chili successful margarita,3
campaign called awareness around help help that small business operator,5
u.s. urban centers,3
Kesadiaz tray advertisers,3
Canyon nationwide rollout,3
webcast select presentation materials,4
bar remains pressured on-the-go usage occasions,5
cost-savings lead operations,3
signs global concerns,3
reps customers intimate relationships,3
Columbia Latin America,3
cold beverages strong beverage mix,3
Ebro Riviana North American pasta,5
chili outperformance casual dining industry,4
favorable tailwinds revenue recognition impact,3
leverage bank covenants,3
CEO Wyman Roberts,3
chili team member satisfaction,3
winter outages hit with subzero,4
tranches company took nice job term loan market,4
QSRs C-stores recovery broad speaking,4
superb natural extracts job on taste,4
standard reclassifies new revenue recognition value card breakage,4
customer unique expense challenges,3
headwinds middle east,3
squeeze board private label manufacturing,3
mobile order powerful driver,3
loyalty program with regard,3
animal substitutes natural vegan-friendly solution fat in plant-based meat,8
recipe Americas showed,3
multi-tier redemption program full national rollout,4
ingredients biotechnologies sustainable way,3
new users hot sauce category,3
midst Tasty Baking,3
john full-time focused international strategy,4
nps customers voice large sample size,4
sites vast majority,3
extraordinary hockey stick,3
a. Director No,3
EVLO other iconic Conagra,3
team performed service near target,3
culture chili big tentpole programs news between big tentpole,6
lion inflationary pressures,3
traffic hard discount retailer,4
spinoff Lamb Weston,3
correlation ability buyers,3
Thai European poultry assets,3
barclays new curbside pickup,3
COVID robust banquet corporate catering channels,3
aPT index shows,3
Impossible breakfast sandwich,3
government significant stimulus key customer segments,3
tuck-in-type vast majority,3
in-restaurant dining good move,3
gotten started united states summer grilling season,6
birds veggie-based meal space,4
customers see elevated,3
