Keyword,Adjusted_Score
casual dining industry model than today,3
customers space Loop Capital,3
atkins FY excellent plan,3
organic range expansions first choice brand choice brand renovation initiative,5
pressure to-go packaging,3
P inflationary pressures,3
customers bad service,3
all-important holiday season,3
historical safety stock,3
EMEA year-ago demand,3
significant deflation single-serve beverage,3
EBITDA tight cost control control on operating,4
wings pandemic-related dine-in,3
u.s. Nitro Cold,3
strong start 30-gram protein shakes,3
quick follow-up local customer channel,3
AR customers banks,3
distribution intense pressure,3
P margin benefited small year-over-year favorability favorability in A,5
bone-in wings different piece counts,3
chicken influence nail natural unpredictability,5
chili mall exposed,3
Plymouth Brooklyn Park,3
relevance parents young people,3
atkins nutritional snacking space,4
turnover normal training expenses,3
removal significant concern concern with payment,4
laxman loyal customer base,3
goldman Adam Samuelson,3
non-independent director bye,3
subject safe harbor provisions,4
co-op middle east,3
lower-than-expected elasticities inflation-justified pricing include consumer demand,5
slight uptick uptick in distribution,4
core North America,3
GOOD campaign plant-based beverages,3
commercial paper borrowings,3
maggiano issue for chili,3
traffic prepandemic dining room,4
juicier new cooking procedure,3
expand digital customer,3
retailers importance aisle,3
mid-teens unconsolidated operations,3
operator Pumpkin Spice cold brew product,5
payments flood deferred cash tax,3
healthy choice power,3
pinnacle point as separate public,3
teavana Shaken Iced,3
yes vis-a-vis branded,3
reflection Canadian reorganization,3
atkins dramatic falloff,3
cnn Rob Lowe partnership with actor,4
India Middle East,3
decarbonization road map,3
restart chili program,3
quarter began saw cow harvest,3
severance movement main impact,3
traditional diet diet for user base,4
donnie D. King,3
awnings chili metal paint,4
healthy choice competes focus on active lifestyle,4
APZ region had substantial growth,3
'our road full recovery,3
customer personalization engine,3
GAAP pro forma results,3
quote year-to-go hiring number,3
nice rebound strong holiday season rebound from last year,5
Americas North America,3
question-and-answer formal presentation,3
famine global pandemic political interest,4
donnie director at goldman st. louis,5
clear set quarter contributed,3
beverage remainder proof-of-concept testing right,4
concentrated activity mass merchandise channel,4
minutes Sunshine All-Purpose,3
days residence aiken resigned,4
chili rewards months post the relaunch,5
retail grocers grocers eliminated,4
u.k. week on behalf meal kits per week,4
e-commerce leading indicator,3
spring summer before everything,4
atkins immune health,3
weather February Uri,3
outside meat purchases rate of outside meat,5
SR members members had,3
piper Brett Wong,3
moves longer-term historic payout,4
hope little holiday spark,3
Flavor Solutions place than Flavor,4
wings million-plus next virtual brand,3
brakes recent performance moderate rate,3
April central california distributors,3
happy holiday season,3
frozen vegetables business returned,3
message initial results self-directed low-carbers,4
piece of material material handling equipment,4
adjust for inflationary cost pressure,3
Europe SAMEA like-for-like sales,3
adobo chicken barley Korean beef,5
soft variety nonorganic wide pan,5
recent proxy filings,3
issues structural versus transitory,3
Europe sales returned Middle East,4
Chili Junior Bridgeman,3
Americas elasticity historical levels,3
fire Finney County august caused plant in august,5
trends softened industry macro volume,3
plants case- ready business,3
automation advanced technologies,3
excellent job display across board,4
board evaluates regular basis,3
saw mixed mixed results Latin American,4
customization customers advantage own proprietary beverage,5
popularity U.S. innovative menu offerings,4
CHF added close,3
pension actual returns,3
stong global demand,3
well-recognized worldwide shortage shortage of vanilla,5
meal replacement behavior,3
flavor Frank solutions ended,4
excellent progress improved profit realization,3
good tailwind tailwind into next year,3
Frank redhot hot sauce,4
ambition stakeholders sustainable value creation,4
Russia alternative sources,3
operations lamb weston,3
[ indiscernible ],3
recipes roof how-to videos,4
Greco Sons company closed,3
room into takeout,3
pressures widespread inflationary,3
program focus on plant continuous improvement-based initiative,4
CAGNY disclosure EPS,3
APZ experienced recovery,3
a. gaps Director Yes,4
baristas Mobile Order,3
Chili major menu simplification,3
terrific quarter Snacks had another terrific,4
internal customer decisions,3
atkins total buyers quarter remained,3
apologies old segment significant upturns,3
atkins walked tough competitive merchandising,3
customers unwavering commitment,3
open book input cost structure,3
brands outperformed respective subsegments,3
spices leadership through packaging,3
evidence amongst value players,3
wings overlay incremental guest,3
virus accelerated consumer demand food through alternative,4
big retailers major buying power marketing services like advertising,6
in-store experience digital customer relationship,4
America view health care,4
flavors modern food attributes,3
RB normal run rate,3
vaccine mandate served,3
laxman Oleato hot beverages did today,5
Flavours Symrise division started,3
SG pension program costs associated receivable sales,5
career Jeremy Scott,3
seasonability sustainable value key nonfinancial target,3
recovery got sectors,3
thanks capitalization grown sales,3
maggiano alcoholic beverages,3
Deutsche EBITDA figure,3
traffic huge variation,3
slight miss base conagra business,3
bulk promotional activity,3
warrants caution current economic environment facing,3
CAP % delivery coverage,3
retail grocery price basis versus retail,3
org slight wage inflation,3
customer love SFE,3
EUR group issued new bonds,3
Wyman make prepared,3
S P high yield dividend,3
regions delivered flavor solution base growth,3
employees El Segundo,3
new lockdown lockdown restrictions,3
pilot actual factual factual results,4
APAC QSR customers increase in promotional activity,5
pandemic effect recedes reversion as pandemic effect,4
transcript live call section of flowersfoods.com,4
equality organizations dedicated,3
d u.k. Ashford CHF,4
a. Steve Kinsey,3
tomorrow unveil full holiday assortment,4
bakeries digital technology,3
Seattle Roastery company-leading comp growth,3
atkins Walmart last count,3
industry-leading scale unique business model,3
pounds programmatic dieters event in mind,4
at-home coffee presence,3
heroes bar price-sensitive environment,3
pickup than dinner,3
birds Duncan Hines,3
Snacks Meal Solutions,3
realization efficient short-term way,3
rep activation customers,3
frosted- sugar cookies,3
massive contemporarization contemporarization through innovation,4
feedback megatrend post-pandemic routines,4
majority snack nut category,3
NRI nutritional snacking assets,3
influence indications reversion,3
friday boneless skinless breast meat,5
Frank hot sauce category,3
premium customized cold coffee category,3
afternoons occasional customer,3
hefty manager bonus,3
customer service training,3
weekend inflection behaviors,3
associates NPS overall satisfaction rates,3
sell-off core hubs,3
forecasts market underperformed underperformed versus,3
pods came single-serve coffee pods,4
CEO non-independent director,3
center Ardent Mills,3
childcare medical clinics,3
Wanda renowned comedian,3
Frontera Grocery Wicked Kitchen,4
subside inflationary pressures,3
celine a.h. pannuti,3
fuel outstanding progress savings helped,3
atkins diet brand weight loss diet,3
toe brains steak,3
pinnacle value-over-volume approach,3
coffee giant closed racial bias education,6
unique offers customer personalization engine,5
mark cap company passed,3
cnn talks traffic,3
Chase first-ever co-branded credit card,4
quick service restaurants strength in quick service,4
policy global clients,3
canyon performance recovered slow start,4
fires plants EPS,3
cattle head feed recorded,4
root Gen Z,3
prestige fine fragrances retail fragrances mass market specialty retail,7
chili guest team member experience,4
bean crop runway with regard,3
relief pound u.s. dollar,3
ability incomparable food safety,3
EPS nonservice income benefit from pension,3
inflation-driven pricing benign consumer response,3
ingredient miss had packaging cost increase,3
Kenny international experience,3
donnie D. King president of poultry,4
food-at-home segment varied recovery diverse customer base,5
Ardent Mills COVID-related demand,4
activities full implementation dedicated resources,3
household retailers personal care care across select,6
Atkins transit high correlation,3
sunflower recall created,3
global scale untapped opportunities,3
chart prepared remarks,3
elevated promotional activity,3
soya backs u.s. situation,4
green tea big hits cold foam caramel,6
Rewards occasional customers,3
prevalent home-cooked meals,3
customer Nitro Cold,3
bellies volatile raw material right,4
GDP massive increase middle class,4
flavor status quo versus,3
visitors international attention,3
assessment pro forma,3
medium-term increases expect wage rate,3
yes much different organization,3
mobilities bars benefited,3
credentials superior experience,3
behaviors noneconomic follow solid foundation,4
traffic serious margin sacrifices,3
EPS excellent free cash flow conversion,3
competitors limited-category manufacturers,3
redistribution rebroadcast without express,4
eligibility recent highlights,3
ability success open-minded seller,4
machine artificial intelligence,3
u.s. customers retail concepts lead consumer perceptions consumer perceptions of specialty,7
decision distribution system network,3
retailers new hard discount,3
movement EBITDA Swiss franc,4
nature Killer Bread,3
atkins low-carb lifestyle weight management expert,4
Morgan Chase celine a.h. pannuti,5
atkins mass pick market share,3
placement drought-induced movement movement into feed,6
atkins little substitutability other shakes,3
bakeries operations sole responsibility,4
Meal Prep division on Slide cash flow generation,4
had sufficient sufficient livestock,3
co-pack guys Smucker Starbucks,4
goldman s.c. Flavor Solutions,4
hundreds consumables retailers fresh products,4
retail takeaway trends,3
low-end customer behavior,3
proprietary modulation technology,3
parade displays social media,3
menu dropped yesterday,3
shortenings oils inflationary right,3
day-to-day interruptions little intermittent,3
zero drive product responsibility responsibility from farm,4
approach financial fitness focus on continuous improvement,3
revert historical norms,3
Monday private label manufacturers association,3
price-pack multiple product configurations architecture with multiple product,5
nice movement movement in manager,4
atkins active nutrition subsegments,3
customers seasons cold platform,3
silver cloud impetus for change,3
menu Chili fundamental move,4
Latin America like-for-like basis,3
industrial [ [ ingredient ] ingredient ] business,6
avian influenza chicken leg quarters,4
reestablishment chili rewards,3
Nature Killer Bread,3
battle prolonged lockdowns,3
material quantifiable drag,3
Chili Wyman Roberts,3
CHF group refinanced multibank committed,4
customers healthy staffing levels,3
big spike absenteeism related spike in absenteeism,4
mustard many customers same shelf presence,4
pinnacle year-ago period different owners,3
HK Anderson EPS,3
dKB launched new organic breakfast,3
believe raw material,3
Levy Non-Independent Director,3
SR multi-tier redemption program,4
tailwind grade intent,3
basis point gap gap between gross profit dollar,3
[ EPS recent quarters,3
flexible work-from-home sustainable benefit benefit from eat-at-home demand,5
experienced deleveraging sales dropped,3
canyon love gluten-free bread,4
George broader-based marketing campaign,3
October Board Directors approved,4
guest team member experience,3
SMEs subject matter experts,4
traditional food brands unique among traditional food,4
chili implementation major technology systems,4
website updated investor presentation,3
pandemic spurred operational complexities,3
abundant value sharp price points quality at sharp price,3
clear focus frozen vegetables superior relative value,4
EPS Ardent Mills venture had,4
share within ready-to-drink shake category,3
real rebuild rebuild of shelf retailer safety stock,6
sit-down restaurants fast-casual type things,3
pressure Flavor Solutions Solutions did,5
updated expectation global coffee alliance,4
COVID-related impact steady inflationary pressure,4
supply caused present opportunities african swine fever,5
sound like sustainability,3
lens return on invested capital,3
rollouts recover with vaccination,3
customers la carte,3
pressure than upward pressure,4
p above-the-trade line considerations,3
perception casual dining segment,3
iconic retail Jimmy Dean,4
F curves dependent upon rate,4
ability facilitate tax advantage deal structure,3
a. Director Sure,3
new wages union-organized stores federal law prohibits,5
big shelf reset shelf reset period,4
perpetual innovator weed-and-feed approach,4
pinnacle preclose internal stand-,4
atkins attitudes behaviors new commercials,4
North Star restaurant support center,3
chicken remains committed top-tier performance,3
updated bar menu,3
additional plants implement full TMOS,3
wings Italian Classics,3
frozen single-serve meals,3
inventory rebuild added,3
servers freeze-up server time,3
flavor natural-based ingredient company,3
absolute penny gap,3
long-term continuation trend for away-from-home food,3
policy contributed other lead market,3
eat outside home,3
recent performance terrific multiyear run,4
over-performance wages third quarter get,3
challenges presented exceptional growth,3
customers bold transformation,3
retention own employees Net Promoter Scores,3
ability different use occasions,3
u.s. square foot tryer offset wage increase,5
Clif nutritious bars,3
beverage dinner difference in check,3
eVP Dean Banks,3
Maggiano % composed fiscal first quarter comp,3
COVID-19 pandemic incredible consumer trialing,3
casual restaurant-style options new mega bowls add,5
historical standards supplier inbound fill rate,3
coffee Iced Espresso,3
Ryals Steve Kinsey,3
millennials cold coffee,3
ConAgra u.s. spicetec acquired,4
Flavor Solutions trajectory than base,3
driver retention bonus visible positive impact,3
peak pre-COVID behavior,3
retailer send message,3
technology order management system,3
e-commerce direct-to-consumer direct-to-consumer new product,3
inflationary pressures tight labor market,3
e-commerce digitization new activity set,4
love chicken EU,3
consideration poultry moved,3
chili casual diners,3
costs associated voluntary separation program,4
Chili head VP,3
massive amount frozen single-serve meals category,4
chicken bell EU opened,4
constraints Steve mute higher-cost inventory,5
commercials organic sales growth did,3
Pinnacle executional issues focus with respect,4
agreement freshpoint announced,3
year-ago period heavy supply supply through second quarter,3
maggiano banquets large party occasions,3
investor.starbucks.com through friday,3
SnapTight lid seals,3
transcript section of flowersfoods.com,3
antitrust issues potential divestiture candidates,5
new geographies Italian specialty platform,3
retailers inventory above late summer inventory,6
young millennial households,3
abandonment central section,3
relationship between casual dining,3
productivity actual headwinds,3
Americas Director Rosalind Gates,4
power EBIT EBITDA basis,3
ton TPDs vast innovation slate,4
soft variety white bread area,4
chicken home popular animal protein,5
NAV see in black box,4
core healthy growth recent quarters,3
Fitness financial fitness total cost takeout,3
PBGC charges variable expense underfunded pension obligations % on underfunded pension,8
hog processor market-ready hogs,4
customers forms home,3
refrigerator recovery frozen segment,3
customers cold beverage innovation,3
farha Ford Stephens,3
remnant household inventory,3
aggressive television campaign,3
get vaccinated comfortable gathering,4
CHF plant-based proteins,3
quest healthy lifestyle snack brand,4
endulge enthusiasts profile for keto,3
'we muscles different set,3
beef segment benefited strong domestic demand,4
competitor buying dairy,3
cnn new interview interview with steven,4
Fragrance division recorded like-for-like basis,3
recession cook at home,3
remainder slight margin contraction,3
global coffee alliance,3
exit winter selling season,4
accessible single source,3
deployment one-size-fits-all program,3
ad chunky around football,4
Molson former CEO Coors International,4
members instant goals hurdle like instant,5
chicken experienced experienced export headwinds,5
EVP provide prepared,3
african swine flu,3
operators did a good,3
atkins relevance total buyers,3
emotions racial injustices,3
RB Foods completed an equity,3
guests have said,3
donnie egg D. King overall breeder production,5
combative retail reaction,3
F b national footprint,3
U.S. Uber Eats,3
headwinds soft volumes guys laid,4
oh lifestyle people Rob Lowe new adjacency,5
company closed closed plants,3
Culver Roz Brewer global coffee,5
Ryals McMullian president interesting opportunities white space opportunities,5
campaign further accelerate growth,3
costco co-op u.s.,3
U.S. onetime stock grant,4
reduced promotional activity,3
first choice advertising,3
Flavor Solutions quick service restaurants experienced slower-than-expected restaurant traffic,7
barclays rocky month-to-month performance,3
COVID-related disruptions 300-basis-point favorable impact,3
shopper trips improved on-the-go usage occasions,6
proper personal protective equipment,3
ketchup Wish-Bone business fits,3
DKB organic wheat cost,3
noel white CEO,3
drought u.s. affordable hays,4
ajay retirement Pivotal Research good luck,4
kitchen COVID-related disruptions impacted sales,4
litigation legal settlement,3
enjoyment at-home eating,3
intermediate term forward-looking supply conditions,3
customers promotional activities,3
sources debit card spend,3
strain rapid rate american consumer,3
new openings openings scheduled,3
coffee Euromonitor addressable market,3
step-up allocation impacted purchase price allocation,3
affords longer-term decisions strong balance sheet,4
cnn bayle ellis,3
new meat snacks optimized price pack,4
a. chance refill Director No,5
extent lockdowns was a surprise,4
industry-leading mobile app,3
real grilling season season starts after Easter,6
in-restaurant feature card,3
chicken No Antibiotics value-added products,4
protein scene wrestle with tariff,4
beef head throughput offset,3
temporary plant closure,3
leverage Joel Hourican,3
normalized inventory builds inventory builds in prep,3
experience exacerbated change in health,3
aisle sixth priority share of at-home coffee,4
doordash partnership with keybanc keybanc capital markets,3
condiments journey through plant,4
rock labor shortage issue,3
have said u.s. protein companies,4
nice flow-through margin-driven,3
e-commerce natural hedge retail doors,5
error month affected ground beef business,3
one-stop shop large national customer,3
pension funded status allows,3
loyalty different purchase behavior,3
Hispanic product exit netted,3
customers modern mixology mixology drove,4
old-fashioned block-and-tackle customer acquisition,3
in-store customers tangible changes,3
e-commerce sales fresh-packaged bread buns,4
fire frozen fish business,3
chicken additional plant closures,3
Frank Britt Brady Brewer,4
Millennials careers generations,3
color nitrogen-flushed bottle,3
incredible surge surge in demand,4
EBITDA bps normal world,3
